Date,Event,Time (KST),Location,Member(s)
May 04,BAD JOO's Kim Namjoo Fan Meeting in Osaka,2:00 & 6:00 PM,TEMPO HARBOR THEATER,Namjoo
May 05,BAD JOO's Kim Namjoo Fan Meeting in Osaka,2:00 & 6:00 PM,TEMPO HARBOR THEATER,Namjoo
May 07,[TV] Girls on Fire Episode 4 (Audition Show),10:00 PM,JTBC, Eunji as a Producer (Judge)
May 14,[TV] Girls on Fire Episode 5 (Audition Show),10:30 PM,JTBC, Eunji as a Producer (Judge)
May 17,Sunchon National University Festival,?,Sunchon National University,Chorong Bomi Namjoo & Hayoung
May 23,2024 Daedong Festival CLOVER station [Ticket to wish],8:30 to 9:00PM,Kyungsung University,Eunji
May 25,Jeong Eunji Fan Meeting "Eunji's Bookstore" in Seoul,2:00 & 6:00 PM,EWHA WOMANS UNIV. SAMSUNG HALL,Eunji
May 26,Kim Namjoo Fan Sign in Taipei,?,?,Namjoo

